{
  "schemaVersion": "agent-fai-offline-knowledge.v1",
  "profile": "offline",
  "source": {
    "repository": "https://github.com/frootai/frootai-core.git",
    "commit": "018931c2fffbe4eb2d3c5a3e86f2041c50fe872d",
    "tree": "1ecd43c8de1cddafe06c5b4b489119e244ffa40b",
    "path": "npm-mcp/index.js",
    "gitBlobOid": "2c0696c2493271839e66abd3778a6bd3908aefc0",
    "sha256": "d82734acd7562a3db4af13acf050028de69d7ad2ce9afc83a218d2baae1ce54b",
    "sourceUpdatedAt": "2026-07-28T14:03:13.000Z"
  },
  "freshnessPolicy": {
    "maximumAgeDays": 30,
    "staleBehavior": "label-stale-never-refresh-or-fallback-silently"
  },
  "uafCompatibility": {
    "offlineAdapters": 7,
    "adapterStatus": "Degraded",
    "capabilityStatus": "Degraded",
    "profileReadiness": "Designed",
    "supportedCapabilities": 0,
    "readinessPromoted": false,
    "sourceInputs": [
      {
        "task": "UAF-T019",
        "packagePath": "lib/agent/offline-authority/uaf-t019-limitations.v1.json",
        "packageSha256": "687fa92727cf009c6017388ce47d0ad5919fc3bd68d91fa7cd20e03c19ff8091",
        "sourcePath": "planning/unified-ai-fabric-foundation/uaf-t019-contract-artifact.v1.json",
        "sourceSha256": "cbaf02f625038e4181a6cfcdf82587a179ccb0497879bcc95b0ec1f5936799f5",
        "authorityState": "local-approved-uncommitted"
      },
      {
        "task": "UAF-T021",
        "packagePath": "lib/agent/offline-authority/uaf-t021-limitations.v1.json",
        "packageSha256": "9224c1c495ce19c4bf0d9e579b3fa92c3da9a2171bfdc75dd755f65840227323",
        "sourcePath": "planning/unified-ai-fabric-foundation/uaf-t021-contract-artifact.v1.json",
        "sourceSha256": "637dc638df8a8eedd409a08fe21f3f5fe0dc1d13229028dcb8c415c08a5075bf",
        "authorityState": "local-approved-uncommitted"
      },
      {
        "task": "UAF-T022",
        "packagePath": "lib/agent/offline-authority/uaf-t022-limitations.v1.json",
        "packageSha256": "d7e25b594286b7bfe8283a1e5a4240f917f8b765061d45aef96aa0038b7e38c2",
        "sourcePath": "planning/unified-ai-fabric-foundation/uaf-t022-contract-artifact.v1.json",
        "sourceSha256": "77092abf1effa132e0db094547f23b11aa832c5da69730c2edb1dc84fd03b10f",
        "authorityState": "local-approved-uncommitted"
      }
    ]
  },
  "schemas": [
    {
      "id": "agent-fai-openapi.v1",
      "path": "commands/agent/agent-fai-v1.openapi.json",
      "sha256": "ed31d1dbd9a70770bf1cbdcc85d2ee10d25c8dabf8fffdd3b3cebed860fe4c2f"
    },
    {
      "id": "agent-fai-render-result.v1",
      "path": "commands/agent/render-result.v1.schema.json",
      "sha256": "f6aa0d9b520f598872c6357346f10ac37e3cb5be84b1ecae893cc40781abdfe1"
    },
    {
      "id": "agent-fai-generated-contracts.v1",
      "path": "lib/agent/contracts/manifest.v1.json",
      "sha256": "49d48f1c1b03f9324f5d70b366cca3fde648c1ab752537b2989085e401831bfb"
    },
    {
      "id": "agent-fai-offline-knowledge.v1",
      "path": "commands/agent/offline-knowledge.v1.schema.json",
      "sha256": "40cbc82820f81035489431fdbe2bdcf0a4b765e5ef6fd7d287e7b3fd6aec7cac"
    }
  ],
  "plays": [
    {
      "id": "01",
      "name": "Enterprise RAG Q&A",
      "services": [
        "AI Search",
        "OpenAI (gpt-4o)",
        "Container App",
        "Blob Storage"
      ],
      "pattern": "RAG hybrid search chunking semantic reranking retrieval augmented generation document qa question answering knowledge base",
      "complexity": "Medium"
    },
    {
      "id": "02",
      "name": "AI Landing Zone",
      "services": [
        "VNet + PE",
        "Key Vault"
      ],
      "pattern": "landing zone infrastructure network security private endpoints rbac governance hub spoke foundation baseline",
      "complexity": "Foundation"
    },
    {
      "id": "03",
      "name": "Deterministic Agent",
      "services": [
        "Container App",
        "OpenAI (gpt-4o)",
        "Content Safety"
      ],
      "pattern": "deterministic agent zero temperature reliable reproducible content safety guardrails filtering consistent",
      "complexity": "Medium"
    },
    {
      "id": "04",
      "name": "Call Center Voice AI",
      "services": [
        "Communication Services",
        "Speech Service",
        "OpenAI (gpt-4o)",
        "App Service (B1)"
      ],
      "pattern": "voice call center speech to text text to speech stt tts real time audio phone ivr customer service",
      "complexity": "High"
    },
    {
      "id": "05",
      "name": "IT Ticket Resolution",
      "services": [
        "OpenAI (gpt-4o-mini)",
        "App Service (B1)"
      ],
      "pattern": "ticket resolution automation helpdesk it service management event driven async message queue workflow",
      "complexity": "Medium"
    },
    {
      "id": "06",
      "name": "Document Intelligence",
      "services": [
        "Document Intelligence",
        "OpenAI (gpt-4o)",
        "Blob Storage"
      ],
      "pattern": "document extraction ocr form recognizer invoice receipt structured output pdf image processing",
      "complexity": "Medium"
    },
    {
      "id": "07",
      "name": "Multi-Agent Service",
      "services": [
        "OpenAI (gpt-4o)",
        "Container App",
        "Cosmos DB"
      ],
      "pattern": "multi agent collaboration handoff orchestration coordinator specialist a2a agent to agent supervisor",
      "complexity": "High"
    },
    {
      "id": "08",
      "name": "Copilot Studio Bot",
      "services": [
        "AI Search",
        "OpenAI (gpt-4o-mini)",
        "Blob Storage"
      ],
      "pattern": "copilot studio low code bot chatbot generative answers knowledge grounding power platform",
      "complexity": "Low"
    },
    {
      "id": "09",
      "name": "AI Search Portal",
      "services": [
        "AI Search",
        "OpenAI (gpt-4o)",
        "App Service (B1)"
      ],
      "pattern": "search portal semantic hybrid keyword vector enterprise search faceted filtering web application",
      "complexity": "Medium"
    },
    {
      "id": "10",
      "name": "Content Moderation",
      "services": [
        "Content Safety",
        "OpenAI (gpt-4o-mini)",
        "APIM"
      ],
      "pattern": "content moderation safety filtering toxic harmful block severity scoring content policy gateway",
      "complexity": "Low"
    },
    {
      "id": "11",
      "name": "Landing Zone Advanced",
      "services": [
        "VNet + PE",
        "Firewall",
        "Key Vault",
        "NAT Gateway"
      ],
      "pattern": "advanced landing zone enterprise network segmentation firewall nsg nat gateway dns private dns zone",
      "complexity": "High"
    },
    {
      "id": "12",
      "name": "Model Serving AKS",
      "services": [
        "AKS (GPU)",
        "ACR",
        "OpenAI (gpt-4o)"
      ],
      "pattern": "model serving kubernetes aks gpu cluster custom model hosting autoscale container registry inference",
      "complexity": "High"
    },
    {
      "id": "13",
      "name": "Fine-Tuning Workflow",
      "services": [
        "ML Workspace",
        "OpenAI (gpt-4o)",
        "Blob Storage"
      ],
      "pattern": "fine tuning lora qlora training dataset preparation model versioning mlops evaluation custom model",
      "complexity": "High"
    },
    {
      "id": "14",
      "name": "Cost-Optimized AI Gateway",
      "services": [
        "APIM",
        "OpenAI (gpt-4o)",
        "Redis Cache"
      ],
      "pattern": "cost optimization finops gateway caching semantic cache token metering rate limiting api management budget",
      "complexity": "Medium"
    },
    {
      "id": "15",
      "name": "Multi-Modal DocProc",
      "services": [
        "Document Intelligence",
        "OpenAI (gpt-4o)",
        "Cosmos DB"
      ],
      "pattern": "multi modal document processing images tables text extraction structured data vision ocr",
      "complexity": "Medium"
    },
    {
      "id": "16",
      "name": "Copilot Teams Extension",
      "services": [
        "OpenAI (gpt-4o)",
        "App Service (B1)"
      ],
      "pattern": "teams bot copilot extension adaptive cards microsoft teams messaging collaboration enterprise chat",
      "complexity": "Medium"
    },
    {
      "id": "17",
      "name": "AI Observability",
      "services": [
        "Log Analytics",
        "App Insights"
      ],
      "pattern": "observability monitoring telemetry kql dashboards alerts application insights log analytics metrics",
      "complexity": "Medium"
    },
    {
      "id": "18",
      "name": "Prompt Management",
      "services": [
        "OpenAI (gpt-4o)",
        "Cosmos DB",
        "App Service (B1)"
      ],
      "pattern": "prompt management versioning ab testing rollback template registry prompt engineering lifecycle",
      "complexity": "Medium"
    },
    {
      "id": "19",
      "name": "Edge AI Phi-4",
      "services": [
        "IoT Hub",
        "ACR",
        "Blob Storage"
      ],
      "pattern": "edge ai phi small language model iot offline inference device deployment lightweight mobile embedded",
      "complexity": "High"
    },
    {
      "id": "20",
      "name": "Anomaly Detection",
      "services": [
        "Event Hub",
        "Stream Analytics",
        "OpenAI (gpt-4o)",
        "Cosmos DB"
      ],
      "pattern": "anomaly detection streaming real time event processing alert iot sensor time series",
      "complexity": "High"
    },
    {
      "id": "21",
      "name": "Agentic RAG",
      "services": [
        "OpenAI (gpt-4o)",
        "AI Search",
        "Container Apps",
        "Key Vault"
      ],
      "pattern": "agentic rag autonomous retrieval multi-source semantic caching citation self-evaluation",
      "complexity": "High"
    },
    {
      "id": "22",
      "name": "Multi-Agent Swarm",
      "services": [
        "OpenAI (gpt-4o)",
        "Container Apps",
        "Service Bus",
        "Cosmos DB"
      ],